{
  "$schema": "https://json-schema.org/draft/2020-12/schema",
  "title": "Recipe",
  "type": "object",
  "required": ["title", "prepTime", "cookTime", "yield", "ingredients", "instructions"],
  "properties": {
    "title": {
      "type": "string"
    },
    "prepTime": {
      "type": "string",
      "format": "duration"
    },
    "cookTime": {
      "type": "string",
      "format": "duration"
    },
    "ovenTemperature": {
      "type": "object",
      "properties": {
        "value": { "type": "number" },
        "unit": { "type": "string", "enum": ["F", "C"] }
      },
      "required": ["value", "unit"]
    },
    "yield": {
      "type": "string"
    },
    "ingredients": {
      "type": "array",
      "items": {
        "type": "object",
        "required": ["name"],
        "properties": {
          "amount": { "type": "number" },
          "unit": { "type": "string", "enum": [
            "tsp",
            "tbsp",
            "cup",
            "fl oz",
            "oz",
            "lb",
            "g",
            "kg",
            "mL",
            "L",
            "pinch",
            "dash",
            "clove",
            "stick",
            "pkg",
            "can",
            "fillet"
          ] },
          "name": { "type": "string" },
          "preparation": { "type": "string" },
          "optional": { "type": "boolean" }
        }
      }
    },
    "instructions": {
      "type": "array",
      "items": {
        "type": "object",
        "required": ["stepNumber", "text"],
        "properties": {
          "stepNumber": { "type": "integer" },
          "text": { "type": "string" },
          "duration": { "type": "string", "format": "duration" }
        }
      }
    }
  }
}
